name;description;saving_carbonamount;category;challenges_picture_file_path;;;
Public Transit Explorer;Use public transportation for all your daily commuting needs for one week. Reduces approximately 30-40 kg of carbon emissions.;30;Transportation;https://res.cloudinary.com/dd45bmmjg/image/upload/v1686229815/public_transport_nie97e.jpg;;;
Carpool Hero;Organize a carpooling schedule with colleagues or neighbors for one month. Reduces approximately 20-30 kg of carbon emissions per participant.;20;Transportation;https://plus.unsplash.com/premium_photo-1658527097412-3186cc7a112f?ixlib=rb-4.0.3&ixid=M3wxMjA3fDB8MHxzZWFyY2h8MXx8cm9hZHRyaXAlMjB3aXRoJTIwZnJpZW5kc3xlbnwwfHwwfHx8MA%3D%3D&auto=format&fit=crop&w=500&q=60;;;
Electric Ride;Rent or borrow an electric or hybrid vehicle for a weekend trip. Results in a carbon emission reduction of approximately 50-70 kg compared to a conventional car.;70;Transportation;https://res.cloudinary.com/dd45bmmjg/image/upload/v1686229814/comunity_category_r1toiu.jpg;;;
Walking Warrior;Commit to walking or cycling for all short-distance errands. The carbon emission reduction varies based on the distance traveled. For example, walking 5 km per week reduces approximately 5-8 kg of carbon emissions.;5;Transportation;https://images.unsplash.com/photo-1519255122284-c3acd66be602?ixlib=rb-4.0.3&ixid=M3wxMjA3fDB8MHxzZWFyY2h8Mnx8d2Fsa2luZ3xlbnwwfHwwfHx8MA%3D%3D&auto=format&fit=crop&w=500&q=60;;;
Telecommute Reality;Work from home or a remote location once a week. The carbon emission reduction varies based on your usual commute distance. For example, telecommuting for 20 km reduces approximately 15-20 kg of carbon emissions.;15;Transportation;https://plus.unsplash.com/premium_photo-1665329006421-4e945f91885f?ixlib=rb-4.0.3&ixid=M3wxMjA3fDB8MHxzZWFyY2h8MXx8d29yayUyMGZyb20lMjBob21lfGVufDB8fDB8fHww&auto=format&fit=crop&w=500&q=60;;;
Unplug Vampire Electronics;Identify and unplug energy-consuming devices that are on standby mode or not in use for a week. Reduces approximately 10-15 kg of carbon emissions.;12;Energy Consumption;https://images.unsplash.com/photo-1610056494052-6a4f83a8368c?ixlib=rb-4.0.3&ixid=M3wxMjA3fDB8MHxzZWFyY2h8N3x8dW5wbHVnJTIwZWxlY3Ryb25pY3N8ZW58MHx8MHx8fDA%3D&auto=format&fit=crop&w=500&q=60;;;
Digital Detox;Take a break from digital devices for one day each week. By reducing energy consumption from electronics, you can save approximately 2-4 kg of carbon emissions.;4;Energy Consumption;https://images.unsplash.com/photo-1526570207772-784d36084510?ixlib=rb-4.0.3&ixid=M3wxMjA3fDB8MHxzZWFyY2h8Nnx8ZGlnaXRhbCUyMGRldG94fGVufDB8fDB8fHww&auto=format&fit=crop&w=500&q=60;;;
Meal Planning;Plan your meals in advance and minimize food waste. By reducing food waste, you can save approximately 10-15 kg of carbon emissions per month.;13;Energy Consumption;https://images.unsplash.com/photo-1569420077790-afb136b3bb8c?ixlib=rb-4.0.3&ixid=M3wxMjA3fDB8MHxzZWFyY2h8Mnx8bWVhbCUyMHBsYW5uaW5nfGVufDB8fDB8fHww&auto=format&fit=crop&w=500&q=60;;;
LED Lighting;Replace all conventional light bulbs with energy-efficient LED bulbs. Reduces approximately 5-10 kg of carbon emissions.;9;Energy Consumption;https://images.unsplash.com/photo-1500462918059-b1a0cb512f1d?ixlib=rb-4.0.3&ixid=M3wxMjA3fDB8MHxzZWFyY2h8MTB8fGxlZCUyMGxpZ2h0c3xlbnwwfHwwfHx8MA%3D%3D&auto=format&fit=crop&w=500&q=60;;;
Power Down Time;Disconnect all non-essential electrical devices for an entire weekend. The carbon emission reduction varies based on the number and type of devices. For example, unplugging a computer and monitor for two days can save approximately 1-2 kg of carbon emissions.;2;Energy Consumption;https://images.unsplash.com/photo-1572260043539-5ad6fa8afad6?ixlib=rb-4.0.3&ixid=M3wxMjA3fDB8MHxzZWFyY2h8MTB8fGdyZWVuJTIwdGltZXxlbnwwfHwwfHx8MA%3D%3D&auto=format&fit=crop&w=500&q=60 ;;;
Plastic-Free Week;Avoid using single-use plastic items for an entire week. Results in a carbon emission reduction of approximately 10-20 kg.;20;Waste Management;https://drive.google.com/file/d/1hmj80g1pZEh1WGx2wx26NPz7LMKPHPKR/view?usp=sharing;;;
Upcycling Project;Choose an item you would typically discard and upcycle it into something useful or decorative. The carbon emission reduction varies based on the item and its lifespan extension. For example, upcycling a clothing item can save approximately 3-5 kg of carbon emissions compared to buying a new garment.;5;Waste Management;https://images.unsplash.com/photo-1613592370120-bb4dee6eca1b?ixlib=rb-4.0.3&ixid=M3wxMjA3fDB8MHxzZWFyY2h8Mnx8dXBjeWNsZXxlbnwwfHwwfHx8MA%3D%3D&auto=format&fit=crop&w=500&q=60 ;;;
Composting Champion;Start a composting system for kitchen scraps and yard waste. The carbon emission reduction varies based on the amount of waste composted. For example, composting 1 kg of organic waste can save approximately 0.5-1 kg of carbon emissions.;1;Waste Management;https://plus.unsplash.com/premium_photo-1680322463073-7125c168136a?ixlib=rb-4.0.3&ixid=M3wxMjA3fDB8MHxzZWFyY2h8MXx8Y29tcG9zdGluZ3xlbnwwfHwwfHx8MA%3D%3D&auto=format&fit=crop&w=500&q=60;;;
Zero Waste Grocery;Shop at a bulk store and avoid packaging waste for one month. Results in a carbon emission reduction of approximately 5-10 kg based on the amount of packaging waste avoided.;10;Waste Management;https://images.unsplash.com/photo-1559837957-bab8edc53c85?ixlib=rb-4.0.3&ixid=M3wxMjA3fDB8MHxzZWFyY2h8Mnx8emVybyUyMHdhc3RlfGVufDB8fDB8fHww&auto=format&fit=crop&w=500&q=60;;;
Paperless Pledge;Go digital and avoid using paper for all your personal and professional needs. The carbon emission reduction varies based on paper usage. For example, saving 100 sheets of paper can save approximately 1-2 kg of carbon emissions.;2;Waste Management;https://images.unsplash.com/photo-1517334526283-a2a3969df57f?ixlib=rb-4.0.3&ixid=M3wxMjA3fDB8MHxzZWFyY2h8MTF8fGRvZ2l0YWwlMjBub3RlYm9va3xlbnwwfHwwfHx8MA%3D%3D&auto=format&fit=crop&w=500&q=60;;;
Meatless Day;Dedicate one day per week to eating vegetarian or vegan meals. Reduces approximately 5-10 kg of carbon emissions.;10;Sustainable Diet;https://images.unsplash.com/photo-1511448598600-c01f02a2ee95?ixlib=rb-4.0.3&ixid=M3wxMjA3fDB8MHxzZWFyY2h8Nnx8dmVnZXxlbnwwfHwwfHx8MA%3D%3D&auto=format&fit=crop&w=500&q=60;;;
Local Food Week;Consume only locally sourced food for a week. Results in a carbon emission reduction based on food sourcing. For example, consuming 10 kg of locally sourced produce can save approximately 5-8 kg of carbon emissions compared to imported alternatives.;8;Sustainable Diet;https://images.unsplash.com/photo-1567131349667-933eb56baec0?ixlib=rb-4.0.3&ixid=M3wxMjA3fDB8MHxzZWFyY2h8M3x8bG9jYWwlMjBtYXJrZXR8ZW58MHx8MHx8fDA%3D&auto=format&fit=crop&w=500&q=60;;;
Plant-Based Potluck;Host a potluck where all dishes must be plant-based. The carbon emission reduction varies based on the number of participants and their usual diet choices. For example, a potluck with 10 participants can save approximately 15-20 kg of carbon emissions compared to a meat-heavy gathering.;20;Sustainable Diet;https://images.unsplash.com/photo-1526016650454-68a6f488910a?ixlib=rb-4.0.3&ixid=M3wxMjA3fDB8MHxzZWFyY2h8Nnx8bWVhbCUyMHNoYXJlfGVufDB8fDB8fHww&auto=format&fit=crop&w=500&q=60;;;
Food Waste Tracker;Track and reduce food waste for a month. The carbon emission reduction varies based on waste reduction. For example, reducing food waste by 1 kg can save approximately 1-2 kg of carbon emissions.;2;Sustainable Diet;https://images.unsplash.com/photo-1564510714747-69c3bc1fab41?ixlib=rb-4.0.3&ixid=M3wxMjA3fDB8MHxzZWFyY2h8M3x8dHJhY2tlcnxlbnwwfHwwfHx8MA%3D%3D&auto=format&fit=crop&w=500&q=60;;;
Sustainable Seafood;Choose sustainably sourced seafood options when dining out or shopping. The carbon emission reduction varies based on consumption. For example, choosing sustainable seafood for 10 meals can save approximately 5-8 kg of carbon emissions compared to non-sustainable options.;8;Sustainable Diet;https://images.unsplash.com/photo-1615141982883-c7ad0e69fd62?ixlib=rb-4.0.3&ixid=M3wxMjA3fDB8MHxzZWFyY2h8NHx8c2VhZm9vZHxlbnwwfHwwfHx8MA%3D%3D&auto=format&fit=crop&w=500&q=60;;;
Shower Power;Take shorter showers for one month. Reduces approximately 5-10 kg of carbon emissions per person.;10;Water Conservation;https://images.unsplash.com/photo-1571781418606-70265b9cce90?ixlib=rb-4.0.3&ixid=M3wxMjA3fDB8MHxzZWFyY2h8NHx8c2hvd2VyfGVufDB8fDB8fHww&auto=format&fit=crop&w=500&q=60;;;
Drip Drop;Fix all leaky faucets in your home. Results in a carbon emission reduction of approximately 1-2 kg.;2;Water Conservation;https://images.unsplash.com/photo-1523413555809-0fb1d4da238d?ixlib=rb-4.0.3&ixid=M3wxMjA3fDB8MHxzZWFyY2h8Mnx8Zml4JTIwc2lua3xlbnwwfHwwfHx8MA%3D%3D&auto=format&fit=crop&w=500&q=60;;;
Rainwater Harvest;Install a rain barrel to collect rainwater for gardening. The carbon emission reduction varies based on water conservation. For example, saving 100 liters of water can save approximately 0.5-1 kg of carbon emissions.;1;Water Conservation;https://images.unsplash.com/photo-1653274578432-ad9e6880ad62?ixlib=rb-4.0.3&ixid=M3wxMjA3fDB8MHxzZWFyY2h8Nnx8cmFpbndhdGVyfGVufDB8fDB8fHww&auto=format&fit=crop&w=500&q=60;;;
Greywater Recycling;Implement a system to reuse greywater (e.g., from showers or laundry) for irrigation purposes. The carbon emission reduction varies based on water conservation. For example, reusing 100 liters of greywater can save approximately 0.5-1 kg of carbon emissions.;1;Water Conservation;https://images.unsplash.com/photo-1605274280925-9dd1baacb97b?ixlib=rb-4.0.3&ixid=M3wxMjA3fDB8MHxzZWFyY2h8OHx8cmV1c2UlMjB3YXRlcnxlbnwwfHwwfHx8MA%3D%3D&auto=format&fit=crop&w=500&q=60;;;
Eco-Friendly Dishwashing;Opt for energy-efficient dishwashing methods (e.g., dishwasher with full loads or handwashing with minimal water). Reduces approximately 2-4 kg of carbon emissions per week.;4;Water Conservation;https://images.unsplash.com/photo-1661337999810-120505b2a912?ixlib=rb-4.0.3&ixid=M3wxMjA3fDB8MHxwaG90by1wYWdlfHx8fGVufDB8fHx8fA%3D%3D&auto=format&fit=crop&w=387&q=80;;;
Thrift Shop Treasure;Buy only second-hand clothing and accessories for one month. Results in a carbon emission reduction based on the amount of new clothing avoided. For example, avoiding the purchase of 5 new clothing items can save approximately 10-15 kg of carbon emissions.;15;Sustainable Fashion;https://images.unsplash.com/photo-1650737736263-67daef292284?ixlib=rb-4.0.3&ixid=M3wxMjA3fDB8MHxzZWFyY2h8M3x8dHJpZnRpbmd8ZW58MHx8MHx8fDA%3D&auto=format&fit=crop&w=500&q=60;;;
Clothing Swap Party;Organize a clothing swap event with friends, colleagues, or neighbors. The carbon emission reduction varies based on the number of participants and the clothing items swapped. For example, a clothing swap with 10 participants can save approximately 20-30 kg of carbon emissions compared to purchasing new clothes.;30;Sustainable Fashion;https://images.unsplash.com/photo-1490481651871-ab68de25d43d?ixlib=rb-4.0.3&ixid=M3wxMjA3fDB8MHxzZWFyY2h8MXx8ZWNoYW5nZSUyMGNsb3RoZXN8ZW58MHx8MHx8fDA%3D&auto=format&fit=crop&w=500&q=60;;;
DIY Fashion;Create your own clothing or upcycle existing garments to extend their lifespan. The carbon emission reduction varies based on the number of clothing items created or upcycled. For example, upcycling 3 old garments can save approximately 5-8 kg of carbon emissions compared to buying new clothes.;8;Sustainable Fashion;https://images.unsplash.com/photo-1514047882-673ad74081a3?ixlib=rb-4.0.3&ixid=M3wxMjA3fDB8MHxzZWFyY2h8MTl8fERZSSUyMGZhc2hpb258ZW58MHx8MHx8fDA%3D&auto=format&fit=crop&w=500&q=60;;;
Rent the Runway;Rent formal or occasional wear instead of purchasing new outfits. Results in a carbon emission reduction based on the number of outfits rented instead of bought. For example, renting 3 outfits can save approximately 5-10 kg of carbon emissions.;10;Sustainable Fashion;https://images.unsplash.com/photo-1574120153654-453fb26e6bd4?ixlib=rb-4.0.3&ixid=M3wxMjA3fDB8MHxzZWFyY2h8OHx8cmVudCUyMGElMjBkcmVzc3xlbnwwfHwwfHx8MA%3D%3D&auto=format&fit=crop&w=500&q=60;;;
Sustainable Wardrobe Capsule;Create a minimalist wardrobe with versatile, timeless pieces that can be mixed and matched. The carbon emission reduction varies based on the number of new clothing items avoided. For example, avoiding the purchase of 10 new clothing items can save approximately 20-30 kg of carbon emissions.;30;Sustainable Fashion;https://images.unsplash.com/photo-1614631446501-abcf76949eca?ixlib=rb-4.0.3&ixid=M3wxMjA3fDB8MHxzZWFyY2h8Mnx8d2FyZHJvYmV8ZW58MHx8MHx8fDA%3D&auto=format&fit=crop&w=500&q=60;;;
Composting;Start composting kitchen scraps and yard waste to reduce landfill waste and methane emissions. The carbon emission reduction varies based on the amount of waste diverted from landfills. For example, diverting 50 kg of organic waste from landfills can save approximately 5-10 kg of carbon emissions.;10;Green Gardening;https://images.unsplash.com/photo-1416879595882-3373a0480b5b?ixlib=rb-4.0.3&ixid=M3wxMjA3fDB8MHxzZWFyY2h8NXx8Y29tcG9zdHxlbnwwfHwwfHx8MA%3D%3D&auto=format&fit=crop&w=500&q=60;;;
Native Planting;Plant native species in your garden to support local ecosystems and reduce the need for excessive watering and maintenance. The carbon emission reduction varies based on the extent of native planting. For example, planting 10 native plants can save approximately 5-8 kg of carbon emissions compared to non-native alternatives.;8;Green Gardening;https://images.unsplash.com/photo-1566804770468-867f6158bda5?ixlib=rb-4.0.3&ixid=M3wxMjA3fDB8MHxzZWFyY2h8NHx8c3RyYXdiZXJyaWVzfGVufDB8fDB8fHww&auto=format&fit=crop&w=500&q=60;;;
Rainwater Harvesting;Install a rain barrel or rainwater harvesting system to collect rainwater for irrigation purposes. The carbon emission reduction varies based on water conservation. For example, saving 1,000 liters of water through rainwater harvesting can save approximately 1-2 kg of carbon emissions.;1;Green Gardening;https://images.unsplash.com/photo-1509635022432-0220ac12960b?ixlib=rb-4.0.3&ixid=M3wxMjA3fDB8MHxzZWFyY2h8MTB8fHJhaW58ZW58MHx8MHx8fDA%3D&auto=format&fit=crop&w=500&q=60;;;
Organic Pest Control;Implement natural and organic methods to control pests in your garden, reducing the need for chemical pesticides. The carbon emission reduction varies based on reduced chemical use. For example, avoiding the use of chemical pesticides for one year can save approximately 2-4 kg of carbon emissions.;4;Green Gardening;https://images.unsplash.com/photo-1581578405048-b6f813432ca4?ixlib=rb-4.0.3&ixid=M3wxMjA3fDB8MHxzZWFyY2h8OXx8cGVzdCUyMGNvbnRyb2x8ZW58MHx8MHx8fDA%3D&auto=format&fit=crop&w=500&q=60;;;
Bee-Friendly Garden;Create a bee-friendly garden by planting flowers and providing nesting habitats for bees. The carbon emission reduction varies based on the support for pollinators and local ecosystems. For example, attracting and supporting 100 bees can save approximately 1-2 kg of carbon emissions.;2;Green Gardening;https://images.unsplash.com/photo-1591735115730-4bf3a351cfe8?ixlib=rb-4.0.3&ixid=M3wxMjA3fDB8MHxzZWFyY2h8NHx8cGVzdCUyMGNvbnRyb2x8ZW58MHx8MHx8fDA%3D&auto=format&fit=crop&w=500&q=60;;;
Minimalism;Adopt a minimalist lifestyle and reduce unnecessary consumption. The carbon emission reduction varies based on the extent of minimalism and reduced consumption. For example, reducing personal belongings by 50% can save approximately 50-100 kg of carbon emissions.;100;Conscious Consumerism;https://images.unsplash.com/photo-1449247709967-d4461a6a6103?ixlib=rb-4.0.3&ixid=M3wxMjA3fDB8MHxzZWFyY2h8M3x8bWluaW1hbGlzbXxlbnwwfHwwfHx8MA%3D%3D&auto=format&fit=crop&w=500&q=60;;;
Repair and Mend;Repair and mend damaged or worn-out items instead of replacing them. The carbon emission reduction varies based on the number of items repaired. For example, repairing 5 items can save approximately 5-10 kg of carbon emissions compared to buying new replacements.;10;Conscious Consumerism;https://plus.unsplash.com/premium_photo-1664372599274-29142b663ee0?ixlib=rb-4.0.3&ixid=M3wxMjA3fDB8MHxzZWFyY2h8MXx8Zml4fGVufDB8fDB8fHww&auto=format&fit=crop&w=500&q=60;;;
Responsible Electronics;Choose electronic devices with high energy efficiency ratings and extend their lifespan through proper maintenance. The carbon emission reduction varies based on reduced energy consumption and electronic waste. For example, using energy-efficient devices for one year can save approximately 50-80 kg of carbon emissions.;80;Conscious Consumerism;https://images.unsplash.com/photo-1555664424-778a1e5e1b48?ixlib=rb-4.0.3&ixid=M3wxMjA3fDB8MHxzZWFyY2h8MTJ8fGVsZWN0cm9uaWNzfGVufDB8fDB8fHww&auto=format&fit=crop&w=500&q=60;;;
Ethical Fashion;Support ethical and sustainable fashion brands that prioritize fair trade, worker rights, and environmentally friendly practices. The carbon emission reduction varies based on reduced support for fast fashion. For example, purchasing 5 ethically produced clothing items can save approximately 10-15 kg of carbon emissions compared to fast fashion alternatives.;15;Conscious Consumerism;https://images.unsplash.com/photo-1672302255324-28009cc288b2?ixlib=rb-4.0.3&ixid=M3wxMjA3fDB8MHxzZWFyY2h8NXx8bG9jYWwlMjBmYXNoaW9ufGVufDB8fDB8fHww&auto=format&fit=crop&w=500&q=60;;;
Mindful Packaging;Opt for products with minimal or eco-friendly packaging. The carbon emission reduction varies based on reduced packaging waste. For example, avoiding the purchase of 10 plastic-packaged products can save approximately 2-4 kg of carbon emissions.;4;Conscious Consumerism;https://images.unsplash.com/photo-1580709584417-62cac02078b1?ixlib=rb-4.0.3&ixid=M3wxMjA3fDB8MHxzZWFyY2h8MTl8fGVjbyUyMHBhY2tpbmd8ZW58MHx8MHx8fDA%3D&auto=format&fit=crop&w=500&q=60;;;
Environmental Volunteer;Volunteer for local environmental organizations or participate in community clean-up events. The carbon emission reduction varies based on the impact of the volunteer work. For example, volunteering for 10 clean-up events can save approximately 20-30 kg of carbon emissions.;30;Community Engagement;https://images.unsplash.com/photo-1578357078586-491adf1aa5ba?ixlib=rb-4.0.3&ixid=M3wxMjA3fDB8MHxzZWFyY2h8Mnx8dm9sdW50ZWVyfGVufDB8fDB8fHww&auto=format&fit=crop&w=500&q=60;;;
Public Transportation Advocacy;Advocate for improved public transportation systems and increased accessibility. The carbon emission reduction varies based on increased public transportation usage. For example, advocating for a new bus route can save approximately 100-150 kg of carbon emissions per year.;150;Community Engagement;https://images.unsplash.com/photo-1521350837072-770f027a7877?ixlib=rb-4.0.3&ixid=M3wxMjA3fDB8MHxzZWFyY2h8NXx8dm9sdW50ZWVyJTIwdHJhbnNwb3J0fGVufDB8fDB8fHww&auto=format&fit=crop&w=500&q=60;;;
Sustainable Community Events;Organize or participate in eco-friendly community events that promote sustainable practices. The carbon emission reduction varies based on the event's focus on sustainability. For example, hosting a zero-waste event can save approximately 50-80 kg of carbon emissions compared to traditional events.;80;Community Engagement;https://images.unsplash.com/photo-1593113646773-028c64a8f1b8?ixlib=rb-4.0.3&ixid=M3wxMjA3fDB8MHxzZWFyY2h8Nnx8dm9sdW50ZWVyfGVufDB8fDB8fHww&auto=format&fit=crop&w=500&q=60;;;
Environmental Education;Conduct workshops or presentations to educate your community about environmental issues and sustainable living. The carbon emission reduction varies based on the knowledge and behavior changes achieved. For example, educating 100 community members can save approximately 100-150 kg of carbon emissions per year.;120;Community Engagement;https://images.unsplash.com/photo-1455849318743-b2233052fcff?ixlib=rb-4.0.3&ixid=M3wxMjA3fDB8MHxzZWFyY2h8MXx8ZWNvJTIwZWR1Y2F0aW9ufGVufDB8fDB8fHww&auto=format&fit=crop&w=500&q=60;;;
Sustainable Transportation;Encourage and participate in sustainable transportation options such as carpooling, biking, or using public transit. The carbon emission reduction varies based on reduced personal vehicle usage. For example, carpooling for one month can save approximately 50-80 kg of carbon emissions.;80;Community Engagement;https://images.unsplash.com/photo-1568568740737-0fcf31d87779?ixlib=rb-4.0.3&ixid=M3wxMjA3fDB8MHxzZWFyY2h8Nnx8dHJhbnNwb3J0JTIwYmlrZXxlbnwwfHwwfHx8MA%3D%3D&auto=format&fit=crop&w=500&q=60;;;
Energy-Efficient Insulation;Improve your home's insulation by adding weatherstripping, caulking gaps, or insulating the attic. By enhancing insulation, you can save approximately 500-800 kg of carbon emissions per year.;700;Home Energy Efficiency;https://images.unsplash.com/photo-1607400201889-565b1ee75f8e?ixlib=rb-4.0.3&ixid=M3wxMjA3fDB8MHxzZWFyY2h8Mnx8aW5zdWxhdGlvbnxlbnwwfHwwfHx8MA%3D%3D&auto=format&fit=crop&w=500&q=60;;;
Smart Thermostat;Install a programmable or smart thermostat to optimize heating and cooling in your home. By reducing energy waste, you can save approximately 200-300 kg of carbon emissions per year.;300;Home Energy Efficiency;https://images.unsplash.com/photo-1634029859957-01b6d9139e2a?ixlib=rb-4.0.3&ixid=M3wxMjA3fDB8MHxzZWFyY2h8Mnx8dGhlcm1vc3RhdHxlbnwwfHwwfHx8MA%3D%3D&auto=format&fit=crop&w=500&q=60;;;
Energy-Efficient Appliances;Replace old, energy-intensive appliances with energy-efficient models. The carbon emission reduction varies based on the specific appliances replaced. For example, upgrading to an energy-efficient refrigerator can save approximately 100-150 kg of carbon emissions per year.;150;Home Energy Efficiency;https://images.unsplash.com/photo-1626806819282-2c1dc01a5e0c?ixlib=rb-4.0.3&ixid=M3wxMjA3fDB8MHxzZWFyY2h8Mnx8YXBwbGlhbmNlfGVufDB8fDB8fHww&auto=format&fit=crop&w=500&q=60;;;
Energy Audit;Conduct a professional home energy audit to identify energy inefficiencies and implement recommended improvements. The carbon emission reduction varies based on the improvements made, such as insulation or energy-efficient appliances. For example, upgrading to Energy Star appliances can save around 300-500 kg of carbon emissions per year.;500;Home Energy Efficiency;https://plus.unsplash.com/premium_photo-1679815130928-b6afd8e454a2?ixlib=rb-4.0.3&ixid=M3wxMjA3fDB8MHxzZWFyY2h8MXx8ZW5lcmd5JTIwaG9tZXxlbnwwfHwwfHx8MA%3D%3D&auto=format&fit=crop&w=500&q=60;;;
Renewable Energy Investment;Invest in renewable energy sources for your home, such as solar panels or community solar projects. The carbon emission reduction varies based on energy consumption and the extent of renewable energy investment. For example, investing in a solar panel system can save approximately 1-2 metric tons of carbon emissions per year.;1000;Home Energy Efficiency;https://images.unsplash.com/flagged/photo-1566838616631-f2618f74a6a2?ixlib=rb-4.0.3&ixid=M3wxMjA3fDB8MHxzZWFyY2h8Mnx8cmVuZXdhYmxlJTIwZW5lcmd5JTIwaG9tZXxlbnwwfHwwfHx8MA%3D%3D&auto=format&fit=crop&w=500&q=60;;;
